{
  "$schema": "../../../tools/schemas/fable2-gpu-divergence-history-v1.schema.json",
  "schema_version": "1.0.0",
  "corpus": "Fable II Native Renderer G1.5C",
  "generated_on": "2026-09-01",
  "repository_pins": {
    "rexglue": "956c6a8b5da4c54b9899a2593e9c67c26de30194",
    "canary": "3a44f20c7bc66db1da583e8a6f0ab740e31908e9"
  },
  "history_records": [
    {
      "history_id": "CAN-0c843efb",
      "repository": "canary",
      "provenance_kind": "COMMIT",
      "immutable_identifier": "0c843efb3279341eefe9dcec2a60885fd14937e1",
      "primary_url": "https://github.com/xenia-canary/xenia-canary/commit/0c843efb3279341eefe9dcec2a60885fd14937e1",
      "commit": "0c843efb3279341eefe9dcec2a60885fd14937e1",
      "parent": "ec664e0f0c26a001b2287d2dc7123c976ce37373",
      "author_date": "2026-08-25T21:32:46-07:00",
      "author": "goldislead",
      "subject": "[GPU] Round normalized unsigned fixed fetches",
      "affected_record_ids": [
        "TEX-004"
      ],
      "locators": [
        {
          "path": "src/xenia/gpu/dxbc_shader_translator_fetch.cc",
          "symbols": [
            "Round normalized results to 16 fractional bits"
          ]
        }
      ],
      "rationale_confidence": "CONFIRMED RATIONALE",
      "rationale_summary": "The commit says two identified titles compare filtered unsigned-fixed samples to Q16 and therefore adds rounding, leaving signed and integer fetches unchanged.",
      "ancestry_relationship": "Direct ancestor of the pinned Canary commit.",
      "limitations": [
        "The cited titles are not Fable II."
      ]
    },
    {
      "history_id": "CAN-22708301",
      "repository": "canary",
      "provenance_kind": "COMMIT",
      "immutable_identifier": "22708301ba76d10aae6f7d7caac8b1cac9e4a8e6",
      "primary_url": "https://github.com/xenia-canary/xenia-canary/commit/22708301ba76d10aae6f7d7caac8b1cac9e4a8e6",
      "commit": "22708301ba76d10aae6f7d7caac8b1cac9e4a8e6",
      "parent": "0c843efb3279341eefe9dcec2a60885fd14937e1",
      "author_date": "2026-08-26T22:43:55Z",
      "author": "goldislead",
      "subject": "[Memory/GPU/Kernel] Initial XPS support",
      "affected_record_ids": [
        "VTX-003"
      ],
      "locators": [
        {
          "path": "src/xenia/memory.cc",
          "symbols": [
            "0x7F000000"
          ]
        },
        {
          "path": "src/xenia/gpu/dxbc_shader_translator_fetch.cc",
          "symbols": [
            "0x1FFFFFFC"
          ]
        }
      ],
      "rationale_confidence": "CONFIRMED RATIONALE",
      "rationale_summary": "The commit makes 0x7F000000 a physical heap and wraps L2 addresses in vertex fetch, index and translator paths.",
      "ancestry_relationship": "Direct parent of the pinned Canary commit.",
      "limitations": [
        "The commit describes initial support and does not prove Fable II uses XPS."
      ]
    },
    {
      "history_id": "CAN-3a44f20c",
      "repository": "canary",
      "provenance_kind": "COMMIT",
      "immutable_identifier": "3a44f20c7bc66db1da583e8a6f0ab740e31908e9",
      "primary_url": "https://github.com/xenia-canary/xenia-canary/commit/3a44f20c7bc66db1da583e8a6f0ab740e31908e9",
      "commit": "3a44f20c7bc66db1da583e8a6f0ab740e31908e9",
      "parent": "22708301ba76d10aae6f7d7caac8b1cac9e4a8e6",
      "author_date": "2026-08-28T20:19:01-07:00",
      "author": "goldislead",
      "subject": "[GPU] Replace AC6 ground hack with scalar approximation rounding",
      "affected_record_ids": [
        "SHD-002"
      ],
      "locators": [
        {
          "path": "src/xenia/gpu/dxbc_shader_translator_alu.cc",
          "symbols": [
            "ReduceFloatPrecision"
          ]
        },
        {
          "path": "src/xenia/gpu/shader_interpreter.cc",
          "symbols": [
            "ReduceFloatPrecision"
          ]
        }
      ],
      "rationale_confidence": "CONFIRMED RATIONALE",
      "rationale_summary": "The pinned commit replaces a title-specific workaround with 21-mantissa-bit rounding for a scalar ALU family and explicitly says exact precision and halfway behavior remain unconfirmed.",
      "ancestry_relationship": "Pinned Canary commit.",
      "limitations": [
        "The hardware model is deliberately not labelled confirmed accuracy.",
        "The affected title examples are not Fable II."
      ]
    },
    {
      "history_id": "CAN-3eab2b8b",
      "repository": "canary",
      "provenance_kind": "COMMIT",
      "immutable_identifier": "3eab2b8b39442e32537610c955fbb8db0c2a6561",
      "primary_url": "https://github.com/xenia-canary/xenia-canary/commit/3eab2b8b39442e32537610c955fbb8db0c2a6561",
      "commit": "3eab2b8b39442e32537610c955fbb8db0c2a6561",
      "parent": "77597d62ae285fbc5b14a234d24b93aaa5cfd13f",
      "author_date": "2026-08-08T09:43:00-07:00",
      "author": "goldislead",
      "subject": "[GPU] Handle tessellated triangle strip and fan draws",
      "affected_record_ids": [
        "VTX-001"
      ],
      "locators": [
        {
          "path": "src/xenia/gpu/primitive_processor.cc",
          "symbols": [
            "kTriangleStrip",
            "kTriangleFan"
          ]
        }
      ],
      "rationale_confidence": "CONFIRMED RATIONALE",
      "rationale_summary": "The commit normalizes strips and fans to triangle lists and creates a runtime conversion buffer when the backend did not bake one.",
      "ancestry_relationship": "Direct ancestor of the pinned Canary commit.",
      "limitations": [
        "No Fable II topology evidence accompanies the change."
      ]
    },
    {
      "history_id": "CAN-3ff230d2",
      "repository": "canary",
      "provenance_kind": "COMMIT",
      "immutable_identifier": "3ff230d23be454b39a9a2904ad0d8a5156e3aa10",
      "primary_url": "https://github.com/xenia-canary/xenia-canary/commit/3ff230d23be454b39a9a2904ad0d8a5156e3aa10",
      "commit": "3ff230d23be454b39a9a2904ad0d8a5156e3aa10",
      "parent": "2b071d9b09195a68464401d333ea6ab4d5bf3e62",
      "author_date": "2026-08-02T10:46:00-07:00",
      "author": "goldislead",
      "subject": "[GPU] Emulate extended-range float16 in render target pack/unpack",
      "affected_record_ids": [
        "RT-005"
      ],
      "locators": [
        {
          "path": "src/xenia/gpu/spirv_shader_translator_rb.cc",
          "symbols": [
            "PackFloat16x2ExtendedRange",
            "UnpackFloat16x2ExtendedRange"
          ]
        }
      ],
      "rationale_confidence": "CONFIRMED RATIONALE",
      "rationale_summary": "The commit states that guest exponent 31 is finite up to 131008 and corrects the previous 65504 clamp and Inf unpack behavior.",
      "ancestry_relationship": "Direct ancestor of the pinned Canary commit.",
      "limitations": []
    },
    {
      "history_id": "CAN-437a7280",
      "repository": "canary",
      "provenance_kind": "COMMIT",
      "immutable_identifier": "437a7280cf95310d518a2f68087aab61403956ac",
      "primary_url": "https://github.com/xenia-canary/xenia-canary/commit/437a7280cf95310d518a2f68087aab61403956ac",
      "commit": "437a7280cf95310d518a2f68087aab61403956ac",
      "parent": "6bef1fbed17734b0c2d2039d20a15241e026045d",
      "author_date": "2026-08-07T03:46:04Z",
      "author": "goldislead",
      "subject": "[GPU] Use EDRAM layout with a single sample addressing scheme",
      "affected_record_ids": [
        "RT-002"
      ],
      "locators": [
        {
          "path": "src/xenia/gpu/shaders/edram.xesli",
          "symbols": [
            "XeEdramOffsetBytes"
          ]
        }
      ],
      "rationale_confidence": "CONFIRMED RATIONALE",
      "rationale_summary": "The commit supplies canonical 1x/2x/4x addressing equations and explains why all resolves, clears, transfers, dumps and interlock paths changed together.",
      "ancestry_relationship": "Direct ancestor of the pinned Canary commit.",
      "limitations": [
        "The commit provides no Fable II pass evidence."
      ]
    },
    {
      "history_id": "CAN-4a863a0e",
      "repository": "canary",
      "provenance_kind": "COMMIT",
      "immutable_identifier": "4a863a0e1a69c88591b46564e637b9a817c70a9a",
      "primary_url": "https://github.com/xenia-canary/xenia-canary/commit/4a863a0e1a69c88591b46564e637b9a817c70a9a",
      "commit": "4a863a0e1a69c88591b46564e637b9a817c70a9a",
      "parent": "6b5c3233d5cc97583ae6971d6a0afab3a3ffc9a6",
      "author_date": "2026-08-22T18:21:08-07:00",
      "author": "goldislead",
      "subject": "[GPU] Fix base map selection with a separate mip page",
      "affected_record_ids": [
        "TEX-005"
      ],
      "locators": [
        {
          "path": "src/xenia/gpu/texture_util.cc",
          "symbols": [
            "base_page == mip_page"
          ]
        }
      ],
      "rationale_confidence": "CONFIRMED RATIONALE",
      "rationale_summary": "The commit explains that mip_min_level is sampler state, preserves separate base allocation, clamps its sampler to level zero and identifies a non-Fable regression.",
      "ancestry_relationship": "Direct ancestor of the pinned Canary commit.",
      "limitations": [
        "The cited regression title is not Fable II."
      ]
    },
    {
      "history_id": "CAN-4cc584f4",
      "repository": "canary",
      "provenance_kind": "COMMIT",
      "immutable_identifier": "4cc584f47d310c95d3686d8f4c9ffb052ee38fcc",
      "primary_url": "https://github.com/xenia-canary/xenia-canary/commit/4cc584f47d310c95d3686d8f4c9ffb052ee38fcc",
      "commit": "4cc584f47d310c95d3686d8f4c9ffb052ee38fcc",
      "parent": "7cd47947b07de30b649fb4224418a659890eab73",
      "author_date": "2026-08-15T10:32:54+03:00",
      "author": "Clippy95",
      "subject": "[D3D12] Fix constant-alpha blending in the RTV path",
      "affected_record_ids": [
        "PIP-003"
      ],
      "locators": [
        {
          "path": "src/xenia/gpu/d3d12/pipeline_cache.cc",
          "symbols": [